comment,subreddit,url,created
Stock List associated with Electric Vehicle Revolution,SPACs,https://www.reddit.com/r/SPACs/comments/jgzc6d/stock_list_associated_with_electric_vehicle/,1603528286.0
Tesla loves movies; especially action movies,axolotls,https://i.redd.it/hxqam41bwxu51.jpg,1603529159.0
[PC]H: Legenary Weapon W: Violet Flux / Offer,Market76,https://www.reddit.com/r/Market76/comments/jgz9z3/pch_legenary_weapon_w_violet_flux_offer/,1603528045.0
"Got my cat Tesla a cigar filled with ""meowijiwana,"" and it instantly started the bunny kicks",BunnyKicks,https://v.redd.it/s9262cqauxu51,1603528539.0
"@WholeMarsBlog: ""Only criticism — and it's a fair one — sometimes i'm not on time. But... I get it done. And the Tesla team gets it done"" — @elonmusk “I said we would do those things. We did them. We’re going to do the Robotaxis too” https://t.co/1P9xBuYv4C",omarqazi,https://mobile.twitter.com/WholeMarsBlog/status/1319788882590744576,1603529381.0
"Front trunk dents near Tesla logo from the factory, did service replace the hood?",ModelY,https://www.reddit.com/r/ModelY/comments/jgzjon/front_trunk_dents_near_tesla_logo_from_the/,1603529096.0
Transitioning to Mid-Large SUV from 2014 Mercedes e350 Wagon,whatcarshouldIbuy,https://www.reddit.com/r/whatcarshouldIbuy/comments/jgzv6y/transitioning_to_midlarge_suv_from_2014_mercedes/,1603530364.0
ARCHIVE - Replaced Model S door handle micro switch - here’s what the online guides don’t tell you in case you want to do it yourself too,TeslaMotorsArchive,https://www.reddit.com/r/TeslaMotorsArchive/comments/jgz8gr/archive_replaced_model_s_door_handle_micro_switch/,1603527875.0
"[XB1] W: Vampires MMG, DCG, Bear Arm, Power fist FSS +1S, Instigating Deathclaw Gauntlet FSS +1S, Bloodied Knuckles FSS +1S H: List",Market76,https://www.reddit.com/r/Market76/comments/jgzafa/xb1_w_vampires_mmg_dcg_bear_arm_power_fist_fss_1s/,1603528094.0
Tesla software leak reveals HEPA filter with Bioweapon Defense Mode coming to Model Y,ModelY,https://electrek.co/2020/10/22/tesla-software-leak-hepa-filter-bioweapon-defense-mode-model-y/,1603528998.0
30 Straight Minutes Of Tesla FSD Driving (No Annoying Music/Commentary),SelfDrivingCars,https://www.reddit.com/r/SelfDrivingCars/comments/jgzv5o/30_straight_minutes_of_tesla_fsd_driving_no/,1603530359.0
"[PS4] H: BELVC tesla, BELVC gaus rifle and TSE laser rifle ultracite W: VELVC LMG",Market76,https://www.reddit.com/r/Market76/comments/jgz7or/ps4_h_belvc_tesla_belvc_gaus_rifle_and_tse_laser/,1603527783.0
We're all guinea pigs for Tesla's latest self-driving tech,SelfDrivingCarsLie,https://www.axios.com/tesla-self-driving-beta-software-6d7210e5-02f2-4b25-9cba-c4a0d816a024.html,1603530323.0
[PC] H: BE90 Gatling plasma W: Q2515 Tesla,Market76,https://www.reddit.com/r/Market76/comments/jgzuof/pc_h_be90_gatling_plasma_w_q2515_tesla/,1603530308.0
Is the tesla self driving beta out right now considered level 2 or level 3?,SelfDrivingCars,https://www.reddit.com/r/SelfDrivingCars/comments/jgzxd8/is_the_tesla_self_driving_beta_out_right_now/,1603530604.0
[XB1] H: TS/E Laser Rifle W: J/E Tesla,Market76,https://www.reddit.com/r/Market76/comments/jgzdao/xb1_h_tse_laser_rifle_w_je_tesla/,1603528400.0
CNET: GMC Hummer EV vs. Tesla Cybertruck: Which all-electric pickup reigns supreme? video - Roadshow,CNET_ALL_RSS,https://www.cnet.com/roadshow/videos/gmc-hummer-ev-vs-tesla-cybertruck-which-all-electric-pickup-reigns-supreme/#ftag=CADf328eec,1603530997.0
[XB1] H: JE flamer W: BEFR fixer & BE? Tesla 2:1 or AAE90 plasma 1:1,Market76,https://i.redd.it/xjcteombxxu51.jpg,1603529500.0
2 Tesla battery suppliers poised to dominate $129 billion market - Business Insider,u_CostBenKMA,https://www.businessinsider.com/lg-chem-catl-samsung-panasonic-byd-ubs-battery-industry-leader-2020-10,1603528560.0
[XB1] H: tse90 Tesla W: offers,Market76,https://www.reddit.com/r/Market76/comments/jgz9h9/xb1_h_tse90_tesla_w_offers/,1603527992.0
Tesla referral code for 6 months of free supercharging,teslareferralcode,https://www.reddit.com/r/teslareferralcode/comments/jgzoke/tesla_referral_code_for_6_months_of_free/,1603529645.0
"[PS4] H: Bloodied Tesla, heavy weapons W: Junkies heavy ballistic weapons, .50 cal or 2mm ec ammo",Market76,https://www.reddit.com/gallery/jgzqki,1603529864.0
"[XB1] H: Weapons, armor and aparell below W: Weapon offers, Bol AP AMR Scout CP/LA/LL/RL, Flux and junk offers",Market76,https://www.reddit.com/r/Market76/comments/jgzlm0/xb1_h_weapons_armor_and_aparell_below_w_weapon/,1603529314.0
Give me your best explanation as to why Tesla’s price is always sitting at 420 lately😂,wallstreetbets,https://i.redd.it/9f3bzhec0yu51.jpg,1603530514.0
Electric Vehicle Stocks,stocks,https://www.reddit.com/r/stocks/comments/jgzeij/electric_vehicle_stocks/,1603528530.0
